{
  "$schema": "https://json-schema.org/draft/2020-12/schema",
  "title": "MCP Description Effective Protocol View and merge fixture case",
  "description": "Structure of each JSON file directly under view-fixtures/. See Sections 4.12 and 4.13 and Proposal 0033.",
  "type": "object",
  "required": [
    "description",
    "operation",
    "inputs"
  ],
  "additionalProperties": false,
  "properties": {
    "description": {
      "type": "string",
      "minLength": 1
    },
    "operation": {
      "description": "view projects one input to one protocol revision (Section 4.12); merge combines the inputs (Section 4.13).",
      "enum": [
        "view",
        "merge"
      ]
    },
    "inputs": {
      "description": "Input MCP Description documents, as paths relative to this file.",
      "type": "array",
      "minItems": 1,
      "items": {
        "type": "string",
        "pattern": "^(inputs/[a-z0-9-]+\\.json|expected/[a-z0-9-]+\\.json|\\.\\./fixtures/expected-(valid|invalid|warning)/[a-z0-9-]+\\.(json|ya?ml))$"
      }
    },
    "revision": {
      "description": "The MCP protocol revision of a view case.",
      "type": "string",
      "pattern": "^\\d{4}-\\d{2}-\\d{2}$"
    },
    "expected": {
      "description": "The expected result document, compared by semantic equivalence (Section 4.13).",
      "type": "string",
      "pattern": "^expected/[a-z0-9-]+\\.json$"
    },
    "expectedFailure": {
      "description": "The requirement anchor that makes the operation fail instead of returning a document.",
      "type": "string",
      "pattern": "^req-[a-z0-9-]+$"
    }
  },
  "oneOf": [
    {
      "required": [
        "expected"
      ]
    },
    {
      "required": [
        "expectedFailure"
      ]
    }
  ],
  "if": {
    "properties": {
      "operation": {
        "const": "view"
      }
    }
  },
  "then": {
    "required": [
      "revision"
    ],
    "properties": {
      "inputs": {
        "type": "array",
        "maxItems": 1
      }
    }
  },
  "else": {
    "not": {
      "required": [
        "revision"
      ]
    }
  }
}
