{
  "description": "Tools with the same name and different x-* values in different revisions stay distinct scoped variants.",
  "operation": "merge",
  "inputs": [
    "inputs/extension-2025-11-25.json",
    "inputs/extension-2026-07-28.json"
  ],
  "expected": "expected/merge-object-extensions-variants.json"
}
