{
  "description": "Projection preserves clientRequirements on every retained primitive without synthesizing requirements.",
  "operation": "view",
  "inputs": [
    "../fixtures/expected-valid/client-capability-requirements.json"
  ],
  "revision": "2026-07-28",
  "expected": "expected/view-client-requirements-2026-07-28.json"
}
