{
  "description": "Projection preserves custom JSON Schema keywords and x-mcp-header annotations in Tool schemas unchanged.",
  "operation": "view",
  "inputs": [
    "../fixtures/expected-valid/custom-tool-schema-keywords.json"
  ],
  "revision": "2025-11-25",
  "expected": "expected/view-tool-schema-keywords-2025-11-25.json"
}
