{
  "description": "Projection preserves x-* properties on every retained eligible object, including Tool examples.",
  "operation": "view",
  "inputs": [
    "../fixtures/expected-valid/object-level-specification-extensions.json"
  ],
  "revision": "2025-11-25",
  "expected": "expected/view-specification-extensions-2025-11-25.json"
}
